Textos_espanol,sdg_predict
[ NUM ] [ NUM ] introduccion estructura derecho penal [ NUM ] estandar persona razonable derecho penal [ NUM ] responsabilidad penal delincuente suerte resultante responsabilidad penal [ NUM ] [ NUM ] criminalizacion sadomasoquismo negacion erotico instanciacion violencia [ NUM ] constitucionalismo limit derecho penal [ NUM ] delincuencia internacional contexto contraste formar juridico juicio moral eutanasia suicidio asistido [ NUM ] derecho anormal teratologia logico criminalizacion [ NUM ] tensión criminalizacion desierto empirico cambio norma reforma violacion [ NUM ] delito preparacion interés seguridad libertad politico delito preparacion interés seguridad libertad politico,16
agua subterranea debatido contexto tarificacion financiacion ocde [ NUM]a [ num]b energiar ocde [ num]b gestion riesgo ocde [ num]e perspectiva amplio abarcar cambio climatico ocde [ NUM]d [ num]a agua subterranea aparecer revisión reforma agua nivel nacional ejemplo fuente [ NUM ] ocde [ num]b informe incluir sección subsección parrafo ilustración referir agua subterranea transmitir conclusión politica especificamente orientado gestor tipo concreto agua subterranea contexto agricultura lugar observacion coherente agua subterranea generalmente estudiado necesario evaluacion profundo reserva practica gestion agua subterranea,6
presente contribucion evalua jurisprudencio tribunal justiciar comunidad europeo materia interpretacion disposición convenio aarhus relativo acceso justicia caso referido mbito temporal aplicacia[num]n disposición acceso justiciar proyecto ejecutado acto especafico legislacia[NUM]n nacional exclusia[NUM]n obligación derivado convenio medida cautelar effet utile disposición acceso justicia abanico posible motivo recurso judicial papel error procedimiento costa procesal admisible acceso justicia asociación ecologista virtud distinto disposición convenio anulacia[num]n permiso relacia[num]n derecho propiedad mostrar jurisprudencia tiempo relevante vinculante suizo miembro ue convenio,16
creditir fiscal expirar [ NUM ] wemau [ NUM]a calcular quinto capacidad generacia[num]n energaa podraa decidir abandonar mercado lugar invertir mejora necesario podraar aumentar precio carba[NUM]n [ NUM ] ofrecer oportunidad fuente energaa renovable ahorra [ NUM ] [ NUM ] tonelada co[NUM ] ao sustituir anualmente ma s millón desplazamiento vehaculo privado ciudad calgary,7
estudio explorar actitud comportamiento percepción etica mostrar estudiante ciencia politica taiwan investigar intención observar etica ambito derechos digital tema libertad expresion libertad asociacion igualdad acceso informacion confidencialidad seguridad proteccion propiedad intelectual ordenador basar él estudio preliminar diseño cuestionario distribuyo [ NUM ] estudiante ciencia politica administracion publicar facultad taiwan dato recogido [ NUM ] muestra valida analizado modelo ecuaciones estructural probar conjunto hipotesis formulado investigador marco teorio comportamiento planificado resultado mostrar actitud norma subjetivo control percibido conducta encuestado influir positivamente observacion personal etica informacion sentido altruismo grupo secundario sensacion seguridad gr,16
tratado paz westfalia [ NUM ] carta naciones unidas [ NUM ] derecho internacional paoblico evolucionado sistema derechos obligación recaproco basado igualdad soberano intervencia[NUM]n asuntos interno [ NUM ] carta naciones unidas centrado sistema seguridad colectivo establecido potencia vencedora guerra mundial [ NUM ] afirmar prioridad juradico tratado internacional conflicto [ NUM ] enfocar unilateral tradicional derecho internacional libertad gobiernos lugar derechos humanos ciudadano mo s cuestionado parlamento nacional grupo sociedad civil incompatible reconocimiento universal derechos humanos inalienabl necesidad legislacia[num]n democra tico protejo derechos humanos paz democra tico [ NUM ],16
existencia creacion vinculo ambito politico proporcionario arquitectura institucional coherente mejorario eficacia politico agua garantizario plan inversion reflejarar prioridad cuenco gasto publico sector ajustar objetivo politico agua potencial coherencia politico ambito cuenca hidrografica mejorar él participacion sistematico organismo consejo cuenco ambito seguir explotar particular agenda preve creacion secretario ordenamiento territorial estrategiar ordenamiento territorial plazo observatorio nacional ordenamiento territorial sustentable instituto nacional planeacion desarrollo asegurar armonizacion plazo politica desarrollo sectorial territorial mexico tal herramienta ayudariar dejar tradicional discusión bilateral ad hoc conagua agencia conafor sedesol sagarpa etc actual configuracion institucional tratar cuestión cambio climatico servir ejemplo movilizar institución clave administracion publica federal coherencia politico vear recuadro [ NUM ] [ NUM ],6
seguridad maritimo principal preocupación malasia nacion maritima obstante cuestion crucial ley adecuado frente principal delito maritimos requerir medida policial eficaz documento constatar ningun delito maritimo tipificado codigo penal principal ley penal malasia ley antipiraterio ley penal especial malasia combatir delito maritimos lamentable falta aplicacion ley apropiado perseguir pirata somalies demostrar urgente necesidad malasio reforma legislativo combatir eficazmente delito maritimos base analisis ley determinado país common law documento concluir sugerencia propuesto ley delito maritimos recomendar gobierno malasia,16
derecho penal internacional dpi contener serie principio general constituir fundamento condición considerar individuo penalmente responsable crimen derecho internacional genocidio crimenes lés humanidad crimenes guerra crimen agresion crimen paz seguridad humanidad mayorio principio general lci aplicado adecuadamente actual edicion codigo penal republico kazajstar documento evalaoo calidad identifico laguna implementacia[num]n ca[num]digo penal kazajsta n sugerir mejora,16
proyecto gasoducto pretender establecer acuerdo interconexion electricidad gas natural asear garantizar seguridad sostenibilidad suministro energetico region tiempo conectar gasoducto terminal regasificacion existente previsto minimizar impacto medioambiental labor dirigido consejo petroleo asear integrado responsable compañia petrolera nacional pais miembro asociacion centrar cooperacion economico regional capacitacion institucional objetivo promover desarrollo recurso energetico incluido energia hidroelectrico facilitar comercio energia region desarrollar recurso energetico renovable alternativo promover eficiencia conservacion energetica,7
argumentar amplio documento legitimidad derecho internacional depender principio pacto respetar él revisar cuestión autopreservacia[num]n proporcionalidad derechos humanos relacia[num]n centrar guerra econa[num]mico terrorismo eeuu formar preeminente expreso ley patriot ley poder econa[num]mico emergencia internacional ley antiterrorista pena muerte efectivo concluir patriot act homeland security act otorgar ejecutivo poder extraordinario ba lico guerra terrorismo examín papel tribunal federal eeuu contexto seguridad nacional proporcionalidad derechos humanos deficiente informar caso concreto relativo movimiento resistencia iranaes estatus respecta terrorismo caso bajkajiar austin alexander respecto proporcionalidad,16
permitir seguimiento puntual despliegue infraestructura energiar limpio ayudar gobierno seguimiento tasa exito proyecto energiar limpio orientar apoyo futuro tecnologia energiar limpio reforzar argumento comercial presentacion banco nacional caso desplieguir generacion expansion red tendro supervisado evaluado tiempo garantizar red capaz cabida cuota generacion electricidad limpio,7
emision c[num ] aumentario [ NUM ] [ NUM ] aplicar mix generacion escenario [ NUM ] aumento desproporcionadamente modesto comparacion numero persona beneficiado aie [ num]b apagón soler deber él corte cargo practico frecuente compensar deficiencia generacion cortar parcialmente carga usuario tabla [ NUM ] confirmar cortes electricidad frecuente país perteneciente ocde perjudicar produccion economico impacto economico subrayar inversion reforzar sistema electrico aumentar cantidad electricidad productivo aumentar ingreso empresa asequibilidad servicio electrico aumentar asegurar viabilidad financiero servicio ageec [ NUM ],7
ley derecho civil [ NUM ] mayor logro historia unidos ley ilegalizo discriminacion eficacia especialmente titulo vii relativo ambito laboral discutida autores sostener cambio legal producir integracion racial lugar trabajo medido presión politica adicional empresa eliminir segregacion examinar fluctuacion presion politico nacional cumplir ley igualdad oportunidad empleo mandato accion afirmativa influencia clave ritmo desegregacion racial lugar trabajo explorar trayectoria integracion blanco negro lugar trabajo ee uu [ NUM ] resultado mostrar presión federal estatal favor igualdad oportunidad empleo tener exito inicial reduccion segregacion racial lugar trabajo avanzado principio decado [ NUM ] llegar conclusion desegregacion racial proceso curso mediado politicamente resultado natural inevitable,16
articulo explorar manifestación corrupcion funcionario local juez real ejerciar autoridad nombre rey explorar complejo contradictoria percepción malo praxis oficial hombre rey particular comprendio peligro representant mancillar reputacion coronar medida adoptado combatir corrupcion mayorio ineficaz resultar retorico vacia debate mostrar noción servicio publico responsabilidad chocar antiguo forma organizacion social politico basada señorio jerarquia tambio n sugerir abordar finalmente atajar corrupcia[num]n encontrar él oragén servicio civil,16
situacion complicar bajisimo indicar recaudacion tasa consumo agua hogar oscilar [ NUM ] [ NUM ] factura enviado empresa suministro agua medio nacional [ NUM ] capitulo [ NUM ] responsabilidad control calidad agua potable recaer departamento seguridad alimentario veterinario proteccion fitosanitaria ministerio agricultura organizar licitación analisis calidad agua potable laboratorio acreditado caso situacion emergencia resultado comunicar municipio caso riesgo sanitario centro publico enfermedad ministerio sanidad trabajo proteccion social mhlsp consejo ministros necesario,6
sinopsis mujer recibir sistematicamente atencion hombre consolidacion paz analisis genero raro informar estrategia relacionado transformacion conflicto articulo examín proyecto peace iii union europeo ue titulado mujer consolidacion paz sharing the learning abordo carencia cuestión naturaleza jerarquico dialogo consolidacion paz sociedad situacion posconflicto sugerir cambiar él mostrar ca[num]mo activista responsable polatico comprometer él ma s torno resolucia[NUM]n [ NUM ] consejo seguridad naciones unidas mujer paz seguridad sostener funcionario gubernamental haber adoptar sistema formulacia[NUM]n polatica mo s contextualizado ascendente podraan engendrado transformacia[NUM]n social proceso ma s amplio transicia[NUM]n posconflicto [ NUM ] conclusión proyecto enmarcir contexto discurso dominante paz seguridad deberaan relevante participar aplicacia[NUM]n resolucia[NUM]n [ NUM ] consejo seguridad naciones unidas sociedad situacia[NUM]n posconflicto,16
agua recurso local fuerte caracteristica territorial explicacion participacion agent subnacional residir principalmente teoria relacionado bien publico local necesidad mecanismo descentralizado lograr asignacion optimo practica aplicacion sistema optimo asignacion agua vario pais raro implica delegacion responsabilidad nivel inferior gobierno gestion agua soler responsabilidad compartido distinto nivel gobierno,6
capitulo identifico impacto derechos humanos religion organización religioso incluido organización benefica religioso basar él jurisprudencia derivado ley igualdad [ NUM ] articulo [ NUM ] convenio europeo derecho sufrir discriminacion motivo religion articulo [ NUM ] derecho libertad pensamiento conciencia religion articulo [ NUM ] derecho libertad asociacion articulo [ NUM ] pacto internacional derechos civil politico articulo [ NUM ] protocolo [ NUM ],16
paás surgido tribunal especializado respuesta presia[NUM]n internacional favor reforma legal eleccia[num]n tribunal encontrar especializado lucha corrupcia[NUM]n tribunal indonesio delito corrupcia[NUM]n yakarta establecido originalmente ley [ NUM ] adquiria[num ] prominencio notoriedad tás condena cercano [ NUM ] ma s [ NUM ] caso [ NUM ] competencia exclusivo caso corrupcion descentralizado tribunal especial corrupcion establecido [ NUM ] capital provincial indonesio prudencia medido criticada cuestionado tribunal regional mantenido profesionalidad tribunal aonico yakarto documento examina raza[NUM]n creacia[NUM]n tribunal tasa condenar indicador aotil rendimiento,16
partir base conectividad tratado requisito previo traduccion impacto capitulo introducir concepto conectividad principio sustantivo compuesto ratificacia[NUM]n convencia[NUM]n eliminacia[NUM]n forma discriminacia[NUM]n mujer cedaw reserva ratificacia[num]n protocolo facultativo op compuesto bito presentacia[num]n informe part frecuencia logo comito capatulo preguntar nivel conectividad depender siguiente caracterastica pertenencia determinado regia[NUM]n mundo tipo ra gimen nivel igualdad ga nero facto nivel nacional capitulo revelar alcanzado alto nivel conectividad principio conectividad sustantivo significativo principalmente disciplín presentacion informe mayorio parte optimo,7
ultima decada producido enorme explosion proveedor seguridad privado gobiernos industria onu organización humanitario rendicion cuenta empresa personal violación derechos humanos seguido ritmo investigador sugerir proveedor seguridad privado funcionar zona gris derecho internacional publico documento sugerimo regulacion internacional soft low internacional transformar él hard law,16
documento evalaoo qua punto solución derecho civil neerlanda s complementar aumentar objetivo polatico paoblico subyacer penalizacia[num]n corrupcia[NUM]n transacción comercial internacional explorar consecuencia contractual extracontractual contrato manchado corrupcion norma derecho internacional privado entrar juego relacion dicho contrato corrupto derecho neerland,16
probable coste asociado perdido continuado biodiversidad importante repercusión termino perdido bienestar reflejar precio mercado observese numero persona carecer acceso agua potable superior carecer acceso suministro basico agua caso contaminacion episodico afectar aluminio causante enfermedad neurodegenerativo plomo enfermedad endemica sistema nervioso,6
flexibilidad significar valor central quedar necesariamente varado cambiar condición regulador econa[num]mica general valor activo riesgo economaa polatica capital bloqueado complejo empresa energo tico algaon momento tendra n desviar él trayectoria habitual plazo cambiar trayectoria emisión especialmente paas ro gimen regulador determinado incierto,7
mostrar capitulo sumo implicado considerable alcanzar [ NUM ] coste inversion nivel plantar inversión generacion energia particular eolico marino sufrir elevado coste conexion red obstante cuestion tratar él punto visto institucional marcos regulador existente partir capitulo anterior caracter tecnico capitulo examina idoneidad disposición actual futuro evolución necesario sector electrico país ocde optimizar prestacion servicio flexibilidad elevado volatilidad cargo cantidad energia renovable variable,7
investigacion dimensión deliberativa democracia notablemente productivo ultimo decado dar lugar conocimiento funcionar deliberacion numeroso foro politico constituir democracia contemporanea teoria normativo democracia deliberativo justificado ocasión inspirado amplio gama desarrollo institucional jurado ciudadano reunión parte interesado sondeo deliberativo foro deliberativo legislacion libertad informacion potencia deliberacion publicar chambers [ NUM ] gastil levine [ NUM ] parkinson [ NUM ] afirmacion clave teoria deliberativa democracia sencillo convincente enfoque deliberativo decisión colectivo condición conflicto producir mejor decisión resultante medio alternativo politica coercion deferencia tradicional mercado probable decisión resultante deliberacion legitima razonable informado eficaz viable politicamente cohir [ NUM ] haberma [ NUM ] gutmann thompson [ NUM ] bohman [ NUM ],16
australio impulso ley estatal nacional derechos humanos persona aparte abogado reclamar ley derechos humanos obvio obviamente necesario analisis sociedad australiano contemporaneo establecer necesidad formo ley derechos humanos apropiado campaña adopcion abogado abogar ley derechos humanos demostrar humildad profesional deferencia profesional agudo apreciacion lugar eficaz movimiento cambio social apoyar movilizacion coalicion amplio defensor ciudadano,16
movimiento moderno estudio juridico empirico antecedent conocido tradición derecho sociedad derecho economia mitad siglo xx conocido conjunto investigación empirica fenomeno juridico periodo guerra mundial articulo extenso ensayo bibliografico examina investigacion juridico empirico lengua inglés [ NUM ] articulo organizar torno tema investigacion justicia penal justicia civil estudio general litigio civil litigio indemnización accident automovil divorcio demanda menor cuantiar jurisdiccion procedimiento jurado civil deuda quiebra banco tribunal apelacion necesidad juridica profesion juridicar incluido educacion juridica dotacion seleccion personal judicial acompaña articulo extenso bibliografia articulo investigacion libro informe,16
regular riesgo incertidumbre cientifico plantear reto particular responsable politico problema amplificir decisión adoptar marco gobernanza supranacional nivel regulacion organismos modificado geneticamente omg union europeo constituir cuestion especialmente destacado gobernanza riesgo escenario multilateral tema politicamente visible tomar decisión lento controvertido autoridad disperso multipl actor gobernanza europeo riesgo necesitar mecanismo adecuado garantizar responsable tomar decisión justificar dar comportamiento aspecto legitimidad gobernanza ogm ampliamente examinado relación rendicion cuenta ambito gobernanza riesgo ogm escasamente explorado documento analizar cuestion exigir responsabilidad marco complejo sistema gobernanzar supranacional riesgo afirmar mero adhesion agent pr,16
base convencional mayorio derechos humanos internacional combinado dualismo sistema juridico common law considerar derechos humanos internacional reducto arraigado modelo tradicional jurisdicción common law caso controvertido recurso interno tunortodoxo derechos humanos internacional encontrar adjudicacion constitucional ejemplo explicito relacion distintivo norma internacional derechos humanos constitución posguerra constitucion sudafricano ejemplo explicito relacion distintivo norma internacional derechos humanos constitución posguerra constitucion sudafricano derechos humanos internacional expresado diverso tratado acto ratificacion llegar ejercer efecto interno obligatorio tribunal insistir relevancia norma internacional derechos humanos razon palabra clave adjudicacion constitucional derechos humanos internacional ratificacion ortodoxo,16
articulo examín retraso sistema justicia penal tiempo medido justicia tardar caso posibilidad corregir fallo tecnico procedimiento administrativo localizar testigo victima posible agresor corto correr riesgo contravenir derecho consagrado constitucion brasileño ley penal producir injusticia lugar justicia ciudadano común tiempo lugar memorio colectivo establecer vinculo delito cometido aplicacion sanción penal sentir aplicado justicia conferir credibilidad institución responsable justicia retributivo articulo explorar afirmación trav estudio empirico investigación penal realizado establecer responsabilidad penal linchamiento perpetrado sao paulo [ NUM ] [ NUM ],16
comentario referencia jurisprudencia brita nico estadounidense considerar principio juradico internacional prohabir tortura probatorio frutos torturo establecer convenio europeo derechos humano enfoqu proteger sociedad contexto riesgo real terrorismo articulo dr kern alexander publicado amicus curiae journal of the society for advanced legal studi at the institutar of advanced legal studi revista producido sals ials institutar of advanced legal studies school of advanced study university of london,16
revelación relativo vigilancia mundial dato comunicación masivo ilustrado claramente escasez regulacion juridica ambito vigilancia afectar inevitablemente derecho intimidad naturaleza notoriamente nebulós intimidad especialmente escala internacional proporcionar suficiente salvaguardia abuso estatal capacidad vigilancia preocupación seguridad nacional privacidad quedar relegada rutinariamente obstaculo incomodo capacidad unidos reino unido cabo vigilancia enorme escala puesto manifiesto insuficiencia marco normativo nacional facilidad traves moderno tecnologio comunicación llevarse cabo vigilancia mundial restricción articulo analizar cuestión examín marco normativo internacional deberio aplicar él vigilancia llevar cabo derecho demo,16
ensayo analizar libro dennis baker not quitar supremar the courts and coordinatir constitutional interpretation mcgill queir s university press [ NUM ] libro baker deberaa sorprender jurista interesado descartar constitucionalismo coordinado irrelevante orientado pretensia[num]n aoltimo baker quedar él corto libro ofrecer relato intrigante separacia[num]n constitucional poder canado insinaoa posibilidad productivo interpretacia[num]n coordinado not quitar supreme baker convenzo contribuir idea importante actual debate disciplina democracia revision judicial carta,16
ppa encargo kema international [ NUM ] estudio cuantificar perdida energio sistema electrico empresa servicio publico pacifico sur incluia pequeño commonwealth pacifico vanuatu ppa kema [ NUM ] recientemente finalizado programa etiquetado normalizacion electrodomestico pacifico cuyo objetivo aumentar importacion venta electrodomestico eficiente punto visto energetico aplicar estrategia iluminacion eficiente pacifico pels sigla ingl contribuir transicion pacifico iluminacion alto eficiencia respetuoso ambiente [ NUM ] ahorro electricidad previsto ma s [ NUM ] [ NUM ] gigavatio hora ahorro asociado importacia[NUM]n combustible [ NUM ] millón litro ahorro emisión [ NUM ] [ NUM ] [ NUM ] [ NUM ] tonelada ma trica equivalente dia[num]xido carbono,7
trabajo realizar án lisis comparativo sentencia juicio cuestionar validez ley garantizar impunidad sector involucrado represia[num]n polatico dictadura seguridad nacional comparacia[num]n seleccionado caso ana lisis caso sima[NUM]n juzgado junio [ NUM ] corte supremo justicia argentina adpfa [ NUM ] juzgado abril [ NUM ] supremo tribunal federal brasil comparar decisión despua s intentar identificar qua explicar verificar conexia[num]n polatica memoria implementado contexto,16
reforma legal amar rico latino aumentado transparencia proceso justicia penal mejorado derecho acusado estudioso conjeturar dicho reforma tambio n mejorar gobernanza extensia[NUM]n desarrollo econa[num]mico parada[num]jicamente tal afirmación estudio cuantitativo examinir efecto preciso dicho reforma legal utilizar conjunto dato original comprobar impacto reforma penal chile derechos delincuente desarrollo econa[num]mico resultado mostrar reforma penal chileno mejorado derecho acusado reducir porcentaje persona encarcelado reforma efecto positivo actividad economico regional efecto inversion extranjero directo nivel regional,16
regulacion sector energetico controlado comision servicio publico puc aaon explotado ningaon emplazamiento escala proyecto catarata amailar estudio gea [ num]b the economist [ NUM ] energiar solar opcion viable electricidad barata interior guyana,7
declaración consejo seguridad naciones unidas secretario general demostrar degradacion medioambiental aceptar amenaza militar paz seguridad internacional documento pertinente proceder considerar responder consejo seguridad amenaza fuente inestabilidad conflicto articulo examina evaluo serie opción disponer consejo seguridad caso miembro decidir abordar agenda detalle sostener carta naciones unidas derecho internacional humanitario precedente operativo proporcionar mandato ambiental consejo seguridad probable autorizacion fuerza limite crimenes guerra ambiente papel medioambiental importante consejo seguridad residir diplomacia preventivo resolucion conflicto reconstruccion postconflicto,16
regia[NUM]n tambio n beneficiaraa cooperacia[NUM]n materia planificacia[num]n energo tico án lisis proyecto marco agendo energo tico sostenible formulacia[NUM]n polatica importante oportunidad pasar sistema energetico limpio capacidad adoptar tecnologia denominado capacidad absorcion desarrollar tecnologia principalmente país adopcia[num]n tecnologaas eficiente requerir economaas escala,7
presente articulo objeto examinar revision judicial entendido control legalidad decisión organo politico organo judicial independiente considerar él principio general derecho nación civilizado termino articulo [ NUM ] [ NUM ] c estatuto corte internacional justicia cij cuestion adquirir importancia carta naciones unidas sucesivo carta aclarar cij derecho revisar resolución organo politico organizacion particular consejo seguridad,16
