Textos_espanol,sdg_predict
estatus caracter erudicion constitucional depender naturaleza ley constitucional unido contenido ley constitucional normalmente negociar dialogo corte supremo pueblo estadounidense consecuencia erudicion constitucional buscar mediar dialogo aclarar implicación sistematica jurisprudencial posible desarrollo constitucional europa derecho constitucional independiente dialogo politico erudicion constitucional relativamente autonoma academico constitucional europeo imaginar proyecto desarrollo estructurar norma constitucional apolitico internamente coherente academico constitucional estadounidense tender desarrollar teoria contexto implicación practica adjudicacion caso caso,16
analista identificado tratado zona libre arma nuclear pacifico sur spnfz [ NUM ] principal logro australio areo diplomacia control arma articulo desafia vision ortodoxo literatura secundario busquedo tratado spnfz australia motivado exclusivamente desear proteger dimension nuclear relacion alianza unido propuesta radical region basar él documento inedito departamento relaciones exteriores comercio poner disposicion autor virtud ley libertad informacion commonwealth articulo argumentar busqueda gobierno hawke zona libre arma nuclear pacifico sur motivado principalmente percibio oportunidad promover imagen australia potencia medio activista comprometido reforzar coherencia regimar global proliferacion,16
opinión judicial minimalista caracterizado produccion corte supremo desarrollado cuerpo academico defender minimalismo judicial saludable restringir tribunal mejorar relacion poder politico centrandome año inicial corte roberts cuestiono valor democratico minimalismo judicial practicar minimalismo judicial representar deferencia poder politico caso socavo transparencia exigir valor democratico,16
tecnico turbina eolica identificar inspeccionar mantener reparar turbina eolica garantizar existir control calidad adecuado objetivo mantener costo mantenimiento bajo calidad alto [ NUM ] ciento tecnico solar ingreso medio reportar ingreso anual oscilar [ NUM ] [ NUM ] [ NUM ] [ NUM ] oficinar estadistica laboral ee uu [ NUM ] ciento pagado tecnico solar ganar [ NUM ] [ NUM ] hora [ NUM ] [ NUM ] año [ NUM ] ciento pagado ganar [ NUM ] [ NUM ] hora reportar ingreso anual [ NUM ] [ NUM ],7
articulo contribuir literatura empirico economia politico politico tributario conjunto dato panel cambio tasa legal adopción impuesto gobierno estatal periodo posguerra hallazgo principal evidenciar respalde modelo reciente ciclo politico enfatizar instrumento politico fiscal corto plazo reduccion impuesto medido acerca eleccion mejorar perspectiva reeleccion momento aumento impuesto claramente relacionado ciclo electoral aumento tasa adopción ocurrir año mandato gobernador examín consecuencia politico acción politico tributario estatal presento evidencia mostrar votante tender culpar gobernador legislaturar aumento tasa impuesto base amplio especialmente aumento promulgado año electoral,16
redirigir innovacion tecnologia sucio tecnologia limpio reducir costo politica ambiental conducir crecimiento economico corto plazo beneficio mayor efecto indirecto superar costo obstante esfuerzo financiero mantener él acelerar él mantener objetivo produccion electricidad emisión gei nulo compromiso asumido [ NUM ] país ue mision innovacion duplicar financiacion publica i d d energia bajo carbono crucial deber fortalecer él futuro,7
empresa privado fomentar fabricacion electrodomestico eficiente instrucción servicio postventar necesario garantizar aplicacion adecuado operacion plazo necesario aumentar economia escala reducirar precio reducirar inversión tecnologia ineficiente costo inicial bajo costo plazo alto mayor impacto ambiental caso normalmente costo adicional asociado equipo altamente eficiente rentable aplicacion electricidad completo,7
septiembre [ NUM ] miembro liga arab aprobar estatuto corte arabir derechos humanos finalizar proceso [ NUM ] año establecer mecanismo proteccion derechos humanos asemejo mecanismo operar región articulo examina extinto carta arabir derechos humanos [ NUM ] carta derechos humanos revisado [ NUM ] mandato actividad cometer arabe derechos humanos explicar redaccion estatuto corte analizar caracteristica destacado estatuto concluyo independientemente carta [ NUM ] comparación pertinente mecanismo regional europeo interamericano africano,16
articulo argumentar impacto esfuerzo aplicacion ley corrupcion merecer atencion academico basar él estudio metodo mixto malawi sur africa operacion policial escala investigar procesar involucrado escandalo corrupcion [ NUM ] conocido cashgate articulo explorar potencial disuadir corrupcion perspectiva funcionario gubernamental servicio civil malawi malawi ofrecer entorno desafiante disuasion capacidad estatal limitado agencia policial debil corrupcion generalizado obstante hallazgo investigacion mostrar funcionario gobierno malawi percibir enjuiciamiento condena disuadar corrupcion  respuesta fuerzas orden publico cashgate especificamente esfuerzo aplicacion ley general hallazgo malawi sugerir aplicacion ley justicia penal potencial contribucion importante estrategia anticorrupcion africa sur global general,16
cargo basico modelo consociacional proporcionar gestion conflicto lograr objetivo plazo resolucion conflicto articulo buscar responder acusacion modelo consociacional traves lente democraticar deliberativa particular argumento democracia deliberativo proporcionar estandar normativo informar diseño institución consociacional animir lider politico centrar él interés sociedad lugar simplemente interés grupo etnico medido institución consociacional concebido deliberadamente efecto principio razon poder proporcionar resolucion conflicto,16
practicar factor capacidad promedio energiar hidroelectrico indio factor carga nacional promedio [ NUM ] [ NUM ] factor incluir deficiencia diseño antiguo central hidroelectrica existente fuerte dependencia lluvia monzonica [ NUM ] potencial hidroelectrico restante [ NUM ] gw region montañoso himalaya figura [ NUM ] [ NUM ] definicion región indio corresponder utilizado analisis modelo geografico anexo b,7
sanción economica considerado herramienta importante disciplinar adversario obligarlo ofrecer importante concesión historio sugerir contrario sanción economica raro abandonar activo nacional importante decada luchar medida financiero punitiva iran persistir politica objetabl terrorismo proliferacion armas destruccion masivo sugerir regimén ideologico valorar prioridad politica aparentemente insensible crecient costo beligerancio candidato adecuado tipo analisis costo beneficio invitar diplomacia sanción,16
capitulo abordo cuestion evolucionar tratar centrado empresa derechos humanos traves promocion continuo practica estatal examina probable surja serie tratado limitado enfocado forma especifico regular corporación prevenir daño punto comparacion articulo examina movimiento anticorrupcion comenzo ley estadounidense prohibio soborno extranjero condujo convencion naciones unidas corrupcion uncac [ NUM ],16
capitulo analizar intento gobierno indio extender politica nacional disputado region cachemiro fuerza seguridad indio imponer medida especial mutilar matar impunidad argumentar derecho otorgado indio sentido cachemires virtud ley poder especial fuerza armado afspa ley draconián aplicado j k usar derecho privacidad ejemplo capitulo demostrar tal enmienda constitucional orden presidencial aprobada gobierno indio [ NUM ] anexion legalizado constantemente desplegado criminalizar demanda soberania socavar autonomia regional libertad personal cachemir,16
capitulo intentar demostrar tendencia convergencia enfocar adoptado tribunal europeo derechos humanos materia jurisdiccion responsabilidad derecho internacional general analisis mostrar decisión jaloud chiragov corte avanzar integracion judicial sentido diferenciar razonado responsabilidad derechos humanos derecho internacional general futuro sentencia tedh debera ofrecer razonamiento juridico consistente mantener tendencia evidente tedh regimar autonomo contribuir integracion judicial,16
principio organizativo sistema gobernanza multinivel subsidiariedad estipular decisión tomar él nivel cualquiera nivel organizacion politico legal razón convincente aconsejen trasladar toma decisión nivel superior ambito judicial principio encontrado expresion procesalmente reglo agotamiento recurso interno sustantivamente margen apreciacion doctrina similar concesion deferencia manifestación judicial principio subsidiariedad deberiar aparecer especial probabilidad contexto tribunal ejercer jurisdiccion denuncia individual derechos humanos articulo investigar punto tribunal subregional africo creacion comenzar incursionar ambito derechos humanos tribunal justicia comunitario cedeao tribunal justicia africa oriental tribunal sur comunidad africano desarrollo reconocido subsidiariedad principio rector,16
[ NUM ] [ NUM ] deduccion fiscal [ NUM ] ofrecido programa reembolso fiscal eficiencia energetico aumento inversion electrodomestico equipo [ NUM ] [ NUM ] millón eur [ NUM ] [ NUM ] millón solicitud coste plan [ NUM ] [ NUM ] millón eur org w bookshop [ NUM ] energy_efficiency_market_report_[NUM ] south africo impuesto renta modifico [ NUM ] incluir regulacion [ NUM]l establecer incentivo fiscal proyecto eficiencia energetico reducir consumo energia exigible [ NUM ],7
apoyo energia renovable fomentar innovacion difusion tecnologia reduccion emisiones alla incentivo proporcionado eu ets analisis ocde mostrar precio carbono aplicacion herramienta politico incluido subsidio objetivo energia renovable biocombustibl conducir superposicion socavar rentabilidad ocde [ NUM]c simplificacion procedimiento administrativo permiso considerar principal obstaculo desarrollo sector energia renovable iea [ NUM]a,7
apuntar combinacion granjar pueblo pueblo pequeño requerir tecnologia politica electrificacion rural configurar distinto necesidad energetica recurso grupo destinatario evidentemente electrificar suburbio importante ciudad indio plantear problema aldeo remoto chino región remoto rural carecer suministro electrico caracterizar desafio identificado distancia razonable red electrica nacional regional pueblo remoto amazonia dificil acceso lejos centro urbano terreno dificil rio selva sufrir condición climatica adverso convertir electrificacion traves extension red tarea peligroso comunidad rural soler disperso bajo densidad poblacion caracterizar nivel educacion bajo densidad cargo generalmente concentrado hora pico noche bajo ingreso,7
sentencia [ NUM ] febrero [ NUM ] caso tomanovic et v the european union et tribunal superior justicia ingl desestimo demanda basado violación derechos humanos eulex kosovo desestimacion tribunal superior baso ultimo instancia faltar incorporacion disposición tratado politico exterior seguridad comun derecho interno sentencia contener extenso obiter dicto analizar cuestión clave derecho union perspectiva resumo contextualizo reflexiono criticamente razonamiento tribunal superior particular centro alcance competencia tribunal justicia pesc aplicacion principio foto frost,16
decision corte supremo apelación conjunto and burgess of the london borough of hounslow v powell leeds city council v hall birmingham city council v frisby representar culminacion serie juicio demostrar aceptacion evolucionar lentamente camar lor tribunal supremo posicion tribunal europeo derechos humanos solicitud presentado autoridad publica recuperar posesion propiedad inquilino ocupar conformidad diverso regimén legal tribunal europeo derechos humanos sostenido proteccion vida privado familiar articulo [ NUM ] convenio europeo derechos humanos cedh exigir acusado solicitud posesion tener oportunidad argumentar orden posesion serio desproporcionado impugnacion proporcionalidad tipo tribunal correspondiente considerar cuestión planteado relacion circunstancia personal acusado,16
ultimos año testigo numeroso proyecto impulsado experto establecer ley ejemplo incluir estudio derecho internacional humanitario consuetudinario comite internacional cruz roja orientacion interpretativo nocion participacion directo hostilidad manual internacional tema tal derecho relativo conflicto armado mar derecho internacional relativo guerra aereo misil guerra cibernetico tener texto cicr producir describir manual texto enumerado reflejar interpretacion expertar ley fragmentada oscuro articulado capitulo [ NUM ] tomar texto enumerado analizar legal reclamar parecer señalar importancia dado complejidad laguna derecho convencional conflicto armado actualmente reflexionar generacion tal manual desarrollo deseable,16
articulo cuestiona derechos humanos formar utopia desafio distopia sociedad contemporaneo desaparecer paulatinamente trayectoria historico derechos humanos incluir periodo emergencia latencio panorama situacion actual revelar avance significativo relacion norma seguimiento denuncia sensibilizacion derechos humanos contradicción particular norma aplicacion nacional soberano literatura sugerir progreso resultado sanción tomar conciencia legitimidad moral derechos humanos escolarizacion educacion general significado especial escuela necesitar cambio profundo conocimiento estudiant establecimiento ambiente basado ejemplo real practicar respeto derechos humanos plan estudio adoptar interdisciplinariedad metodologia activo alentar estudiante asumir papel protagonico palabra clavederecho humanos educacion derechos humanos curriculo modernidad,16
marco grupo directivo agua conferencio interministerial ambiente ccim presidido agencia flamenco ambiente organo consultivo encargado necesario coordinacion implementacion politico internacional agua país belga autoridad cargo asesora planificacion estrategico politica hidrico plazo realizar propuesta mecanismo institucional incentivo garantia implementacion politica hidrica areas rural urbano adopto acuerdo necesario implementacion estrategia nacional integrado agua buscar coordinar acción ministerio proteccion ambiental salud finanza relación exterior infraestructuro soliar colectivamente responsable proceso tomar decisión asunto relacionado agua alcantarillado,6
resumen impulsado fracaso intervención consolidacion paz abajo dirigido internacionalmente donant internacional postulado actor sociedad civil desempeñar papel crucial consolidacion paz resolucion conflicto llevado aumento notable apoyo sociedad civil integrar perspectiva local intervención consolidacion paz ultima decada usar caso chipre articulo desafiar premisa argumentar apoyo continuo crear discurso homogeneizado representativo diversidad noción local paz mayorio tipo apoyo internacional actor sociedad civil adaptir agenda prioridad externo excluir voz alternativo profesionalizada critica actor paz local resistir gubernamentalidad liberal acceso apoyo monetario necesario sostener trabajo paz proteccion internacional causar tiempo actor wo,16
auge disciplina derecho gent venir acompañado moralizacion nocion cosmopolitismo obra hugo grotius samuel pufendorf emer vattel catalogado kant trist consolador derecho internacional mostrar positivismo progresista base definar relación pueblos corriente pensamiento contribuyo significativamente perdicion perspectivo relación internacional preocupado principalmente derecho inviolable individuo entendido ciudadano mundo aportar christian wolff disciplina contemplar capitulo posicionamiento ambiguo cosmopolitismo juridico postura realista intención colonizadora,16
articulo explorar aspecto traduccion multilinguismo politico linguistico campo sociedad civil transnacional centrar él politica traduccion amnistia internacional organizacion gubernamental internacional desempeñar papel clave gobernanza global articulo buscar contribuir sociolinguistico sensible globalizacion argumentar combinacion enfocar sociolinguistico precisamente etnografia linguistico estudio traduccion conducir comprension practica linguistica estudio articulo pedir investigacion interdisciplinario afirmar espacio sociolinguistico estudio traduccion contribuyan investigacion relación internacional estudio desarrollo resaltar papel multilinguismo desafiar posicion tradicionalmente poderoso ingl sociedad civil transnacional,16
experiencia descentralizacion sector agricola resultado ganancia usuario agua control autoridad local administrar agua sobreexplotacion historico agua agricola factor unir usuario agua comunidad riego diseñar estrategia permitir continuar produccion ejemplo objetivo estrategico agenda relacionado acceso universal servicio agua distincion región urbano rural respecta tratamiento agua residual localidad mediano rural construccion pozo captacion agua lluvia,6
israel transferir anualmente [ NUM ] [ NUM ] millón metro cubico agua llanura costero cuenco rio jordan cuenca acuifero occidental desalinizacion franja gaza limitado espera aumente significativamente proximos año [ NUM ] union europea anuncio apoyo construccion plantar desalinizadoro volumen corto plazo abastecer [ NUM ] [ NUM ] persona gobernación khaber yunis rafah,6
rol potencial empresa apoyar paz situación conflicto proporcionado area investigacion denominado espiritu empresarial paz paz traves comercio negocio paz pacificacion corporativo ensayo termino negocio abarca microempresa pequeño mediano empresa responsabilidad social empresa transnacional aplicar teoria contacto corporación mediacion etn actor economico clave impacto economia nacional empleo inversion recurso natural medio comunicacion empresa fortalecer consolidacion paz estructural cultural prevencion conflicto reconstruccion posconflicto potencial empresa apoyar establecimiento paz condición violencia directo empresa iniciar apoyar intervención mediacion proporcionar recurso apoyo administrativo logistico tal intervención palabra clave emprendimiento paz negocio corporación transnacional mediacion construccion paz pacificacion resolucion conflicto emprendimiento social derechos humanos teoria contacto contacto extendido,16
particular obligacion publicar diciembre [ NUM ] plan hidrologico cuenco fuerte impulsor gestion agua miembro ue vecino interesado aplicacion disposición dma bielorrusia planes complejo proteccion agua interesado comparar plan gestion cuenca fluvial ue faltar recurso capacidad vecino preparacion plan gestion cuenca hidrografica apoyado principalmente donant externo implementacion plan desarrollado caso avanzar lentamente,6
ejemplo area energio biomasa interacción significativo sector energiar agricultura silviculturo menor dependencia combustibl biomasar convencional reducir presion recurso forestal dependencia biocombustibl liquido aumentar presion recurso agricola implicación agricola tierra medio vido rural seguridad alimentario esfuerzo desarrollo país pobre fracasarar contar apoyo financiacion sustancialmente prestar cuidadoso atencion desarrollo capacidad sostenible ocde [ NUM ] desarrollo capacidad proceso persona organización sociedad conjunto desencadenar fortalecer crean adaptar mantener capacidad tiempo ocde [ NUM ],7
proposito articulo explorar participacion publicar perspectiva desarrollo paralelo gobernanza urbano inglés [ NUM ] intento modernizar gobierno local enfoque basado areas empleado abordar exclusion social documento situar desarrollo sistema gobernanza multinivel destacarir importancia ejar localidad barrio documento buscar explicar cambio actual basar él teoria gobernancer enfasis mecanismo reunir interés local relevante asegurar coherencia estabilidad asuntos gobierno local combinado enfoque especifico papel ciudadano comunidad socio clave arreglo resonar fuertemente preocupación clave teorio regimar fortaleza limitación teorio regimen discutir particular referencia cuestión especificidad contextual introducir gobernanza comunitario comprender institucion,16
poblacion [ NUM ] [ NUM ] [ NUM ] hab km area recargo croacia eslovenia areo descargo eslovenia drenaje sistema agua superficial agua subterranea cubrir agua utilizado esloveno direccion flujo agua subterranea croacia eslovenia cantidad agua manantial fluctuo significativamente geomorfologiar karstico escasez agua verano problema minimo hidrologico corriente superficial sequia,6
guerra terrorismo inseparable causar muerte discapacidad profundo daño psicologico destruccion ambiente perturbacion infraestructuro sanitario crisis refugiado aumento violencia interpersonal autodirigido colectivo sistema arma armas destruccion masivo mina terrestre efecto devastador especifico preparacion guerra terrorismo imponer restricción libertad civil derechos humanos aumentar militarismo desviar recurso atencion medica servicio necesario prevenir guerra terrorismo abordar causa incluir recurso limitado injusticia pobrezar enemistad etnico religioso fortalecer nación unidas tratado controlar sistema arma especifico particular arma destruccion masivo particular unido cesar injerencia asunto interno naciones defensa guerra preventivo unilateral,16
esfuerzo enfrentar terrorismo transnacional trav ley nacional extradicion crear riesgo impunidad delincuente atroz eventualmente estimulo cooperacion criminal transnacional provoco intento comunidad internacional estandarizar regla areo articulo comunidad internacional buscado cooperacion criminal transnacional terrorismo traves variedad medio legal numeroso tratado sectorial esfuerzo redactar tratado internacional integral convención regional medida consejo seguridad onu responsabilidad crimén guerra debate crimar emergente derecho consuetudinario internacional definicion represion terrorismo implicar juicio social politico dificil derecho violenciir fin depender alcance definicion internacional terrorismo excepcion criminalizacion terrorismo correr riesgo empoderar incluido autocratico expensa reclamo politico legitir violencia,16
informacion util brindar asesoramiento tecnico basado analisis realista solicitar organización internacional regional agencia institución especializado socio desarrollo apoyar coordinado implementacion presente declaracion i resolución aprobada conferencia publicacion naciones unidas [ NUM ] i [ NUM ] correccion resolucion [ NUM ] anexo i b ibid i resolucion [ NUM ] anexo presente plan accion regir resolucion [ NUM ] [ NUM ] asamblea general promocion fuente energiar renovable asamblea declaro periodo [ NUM ] [ NUM ] decenio naciones unidas energiar sostenible principio contenido declaracion ministerial declaracion,7
corte supremo sostener unido v jón seguimiento prolongado gps infringe inter cuarta enmienda dejo significar requerir orden judicial actividad vigilancio tipo base precedente corte supremo abordo directamente problema discrecion norma restricción proponer tribunal pruebir constitucionalidad accion policial tipo examinar idoneidad garantia procesal cumplimiento real policia consecuencio variedad escenario involucrir tecnologia necesitario crear garantia razonable discrecionalidad estandar cumplir garantia accion estatal considere constitucional,16
   gobierno responder terrorismo torturar gobierno enfrentar incentivo aumentar torturar respuesta ataque terrorista investigación anterior encontrar relacion terror tortura estatal argumentar sorprendente incentivo violar derechos humanos diferir agencia gubernamental nacional usar dato desglosar tortura estatal agencia gubernamental responsable abuso investigar efecto terrorismo transnacional domestico tortura perpetrado oficial militar encontrar agente militar especialmente democracia participar tortura sustancialmente generalizado enfrentar terrorismo comportamiento particularmente probable respuesta ataque transnacional,16
   afectar politica institución gubernamental desempeño mercado valor medido mercado bursatil amplio profundo país africano preguntar vuelve criticar dinamica calidad gobierno control corrupcion eficacia gobierno estabilidad politico violencia voz rendicion cuenta calidad regulacion derecho instrumentar nivel ingreso dominación religioso grado libertad prenso origen legal dinamicar desempeño bursatil capitalizacion valor negociado rotacion numero empresa listada resultado demostrar asociacion positivo significativo medida desempeño mercado valor calidad institución gubernamental hallazgo sugerir país institución gubernamental desarrollado favoreceriar mercado bursatil capitalizacion mercado mejor indiz rotacion valor acción negociado numero empresa cotizado,16
articulo explorar metodologia judicial sistema legal mixto quebec examina particular naturaleza sistema legal sistema legal mixto influir metodologia judicial juez especialmente facto precedente caracteristica mezcla incluido marco institucional tribunal quebec tribunal jurisdiccion inherente naturaleza sistema justicia civil derecho procesal quebec funcion judicial efecto autoridad precedente supremo tribunal supremo tribunal canado examinar factor influyente,16
luz cambio reciente dialogo estandar derecho estricto ambito empresa derechos humanos articulo proporcionar examen profundidad viabilidad tratado empresa derechos humanos buscar avanzar modelo teorico valido tratado abordar directamente actor estatal explorar asignacion responsabilidad multipl titular deber contemplir alcance contenido cumplimiento obligación potencial complementar analisis analogia extraida regimén tratado existente articulo pretender contribuir positivamente desarrollo normativo derecho internacional materio,16
