Textos_espanol,sdg_predict
caido produccion fosfato punto maximo [ NUM ] sector residencial domestico usuario dominante nauru depender completamente petroleo figurar [ NUM ] [ NUM ] importación combustible representar [ NUM ] ciento pib [ NUM ] spc [ NUM ] comision servicio publico nauru nuc proporcionar servicio energiar nauru campo refugiado australiano plantar procesamiento principal corporacion fosfato republico nauru ronpho generar energia gobierno compra petroleo abastecer cliente ronpho realizar compra,7
objetivo ensayo identificar base legal obligación rendicion cuenta organización internacional oi persona afectado politica especificamente pregunto ejemplo union europea organizacion mundial comercio rendir cuenta individuo ciudadano organización ver él afectado politica exploro fundamento tradicional obligación rendicion cuenta virtud derecho interno motivo potencial dicho obligacion rendicion cuenta derecho derechos humanos administracion fiduciario rechazar candidato ensayo ofrecer concepto tutela servir base normativo surgimiento derecho administrativo nivel global argumento concepto arraigado ley incumbe oi,16
articulo analizar caso especifico sanción selectivo combatir financiacion terrorismo union europeo nombre consejo seguridad naciones unidas caso planteo serie problema relacionado sanción actor estatal provoco desafio legal tribunal justicia union europeo caso judicial europeo presentado desafio sanción selectivo consejo seguridad mantener paz seguridad internacional criticar fundamental sanción dirigido cumplir proceso derecho proteger derechos humanos individual,16
brasileño quejar investigación corrupcion servidor publico prolongar año generar sanción legal perpetrador faltar rendicion cuenta generalizado invoco frase argot acabou em pizza investigación concluyent articulo investigar papel institución publica brasileño encargado servidor publico rendir cuenta analisis dividir proceso rendicion cuentos etapa componente supervision investigacion sancion traves estudio caso destacado corrupcion mostrar debilidad proceso rendicion cuenta brasil unicamente faltar eficacia institución individual rendicion cuenta independencia tal institución etapa hallazgo sugerir arreglo institucional influir grado rendicion cuenta confianza publicar democracia americo latino,16
relacion descentralizacion corrupcion intrigado experto ultimos año defensor descentralizacion identificar explicitamente lucha corrupcion objetivo potencial herramienta atractivo experto etico sector publico demostrar conexion adecuado articulo argumentar descentralizacion gobierno fomentar compromiso civico administracion publicar espiritu civico promover honestidad rendicion cuenta examinar linea principal literatura asociar descentralizacion corrupcion vinculan rendicion cuenta sector publico proximidad gobierno persona habilitado descentralizacion brindo administrador ciudadano oportunidad cambiar valor servicio publico reforma estructuro gobierno,16
papel organización internacional ambito gestion conflicto consolidacion paz africo acontecimiento digno mencion naciones unidas organización internacional asumido rol intervención mediacion mantenimiento paz consolidacion paz conflicto ejemplo proceso consolidacion paz mediacion kenia dirigido exsecretario general onu kofi anar violencia postelectoral [ NUM ] [ NUM ] capitulo examín criticamente papel organización internacional formacion idea difusion norma material medido convertir criterio implementar consolidacion paz contribucion argumentar modelo unico capturar condición local capacidad entorno politico especifico prevencion gestion resolucion conflicto,16
opinion general oportunidad potencial cuantificacion dificil trabajo reciente organismo internacional naciones unidas ocde oit cedefop tratado evaluar oportunidad actual futuro relacion crecimiento verde trabajo pañal mercado mundial bien servicio ambiental baja emisión carbono crecer londr crecimiento sector carbono mantenido significativamente tasar crecimiento tendencial economia londinense crisis financiero mundial similar inversion capital riesgo industria verde aumento participacion mercado general [ NUM ] [ NUM ] [ NUM ] [ NUM ] [ NUM ] valor neto us [ NUM ] mil millón [ NUM ] [ NUM ] sugerir sector servicio financiero pujante sydney ubicado desarrollar producto servicio financiero ecologico comerciar bono financiamiento carbono marco regulatorio politica apoyo declivir curso sector manufacturero problematico impulsado desindustrializacion cambio economico global cambio crecimiento ecologico,7
ultimos enfrentar riesgo alto proporcion energias renovable variable eolico solar reducir numero hora garantizar determinado demanda efecto compresion papel red inteligente caso remodelar demanda residual curvo demanda traves respuesta demanda cambio cargo integracion aplicación almacenamiento red inteligente cambiar curva cargo restablecer demanda estable continuo periodo tiempo prolongado formar lograr demanda minimo numero suficientemente elevado hora dar lugar papel carga base nuclear sistema fuerte penetracion fuente energiar renovable,7
documento analizar experiencia internacional proteccion derechos trabajador migrant lección relevante experiencia kirguistar analizamos dimensión ayudar determinar resultado migrant país origen migrant organizar gestion politica migratorio institución desarrollado país apoyar migrant laboral proteccion migrant abuso reclutador empleador responsabilidad fuerza orden politica reducir discriminacion abuso trabajador migrant politica facilitar portabilidad pensión migrant acceso atencion medica servicio social forma país movilizar recurso diasporar desarrollo economico local modos cooperacion internacional areas migracion derechos humanos base lección dimensión desarrollamos recomendación politica kirguistar,16
proceso contribuido crecimiento región megaurbana jón douglass [ NUM ] demanda agua recurso natural cambio intensificado demanda agua altamente contaminante agua desarrollo afectar sistema agua traves desvio agua traer uso agua crear cambio ecologico permitir extraccion rapido recurso natural madera desplazar numero habitante caso asentamiento largo historia nucleo cultural,6
sistema legal etiopio pertenecer medido sistema derecho civil contrario sistema jurisprudencia caracteristica distintivo sistema derecho consuetudinario recientemente legislatura federal etiopio promulgado ley introducir norma sentencia dictado sala casacion tribunal supremo federal serio vinculante tribunal subordinado nivel federal regional documento investigar encajario sistema jurisprudencia sistema legal etiope,16
centralidad daño crimar criminalizacion creciente inter daño base politico control crimen haber reflexion sistematico criminologio daño criminal identificacion evaluacion comparacion articulo revisamos literatura daño crimar concepto relacionado percepcion gravedad costo crimar impacto victimizacion criminal daño relacionado droga cuerpo trabajo relacionado sugerir razon insuficiencia percepcion metodo analitico promover enfoque basado daño identificar desafio sustancial evaluacion daño crimar concluir desafio evaluacion sistematico base empiricar daño actividad delictivo desempeñar papel importante analisis politica,16
impuesto subsidio estimular edificio ecologico desarrollar tecnologia ahorro energio ayudariar reducir emisión gei impacto combinado contramedida mostrar figura [ NUM ] [ NUM ] país aseir planificacion economico nacional impacto actividad afectar ambiente,7
   medida separacion poder afectar comportamiento votacion nominal congreso responder pregunta ofrezco modelo estrategico tomar decisión congreso afirmar miembro congreso persigar objetivo politico publicar votar nominalmente predicción equilibrio modelo formal genero hipotesis comprobabl calcular cantidad neto esperado comportamiento sofisticado sincero congreso dado cambio contexto decision pruebo predicción modelo teorico dato votación nominal derecho civil congreso [ NUM ] [ NUM ] resultado demostrar camara legislativa corte supremo restringen profundamente miembro camarar senador emitir voto nominal fuerte evidenciar importancia resultado politica miembro congreso votar pleno,16
recientemente consideracion aspecto salud publicar produccion energia vuelto prominente agenda energetico global iea [ NUM ] oms [ NUM ] osterholm kelly [ NUM ] nivel mundial genero escasamente integrado politica energetica caso sector energetico principio [ NUM ] [ NUM ] país habiar promulgado politica regular promover energia renovable generacion energia calefaccion refrigeracion transporte ejemplo union europeo establecido regulación regir sector energetico allo [ NUM ] establecer meta regional [ NUM ] participacion energias renovable [ NUM ] ren[num ] [ NUM ],7
objetivo investigacion evaluar implementacion mecanismo acción promover garantizar derechos humanos administracion publica municipal descentralizacion constitucion federal [ NUM ] municipio recibir competencia traspaso responsabilidad influyo directamente politica derechos humanos escenario caracter neoliberal ambiente difuso competencia claro surgen vacio conocimiento especialmente papel municipio construccion sociedad inclusivo analisis indicador gestion municipal publicado instituto brasileño geografia estadistico trazar panorama gestion municipal derechos humano cear mostro omision ayuntamiento,16
debate feminista islamismo tema seguir polemico insuficientemente explorado incluido relacion fundamentalismo religion situacion islamismo relacion supuesto crisis modernidad busquedar autenticidad legitimacion traves democratizacion multiculturalismo conexion fundamentalismos politico extremo derecho valor cualitativo atribuido centralidad ampliamente reconocido mujer islamismo identidad cultural articulo explorar tema discutir marco discursivo problematico generalmente abordo tema discurso orientalista demonizar esencializa islam mundo musulmar discurso multiculturalista legitimo mayorio voz islamica fundamentalista nombre diferenciar cultural agencia mujeres discurso pluralista distancia uso politico abiertamente derechista islam mantener postura apologista relacion islam,16
tiempo importante potencial sugerido tabla [ NUM ] [ NUM ] inducir futuro tecnologico carbono necesitar atenuar él lección transición historica predominio actual combustible fosil relacionar costo relativo ventaja rendimiento tecnologia bajo carbono smil [ NUM ] inicialmente ventaja rendimiento dominar transición energetica historica,7
aie sugerir [ NUM ] emisión energia c[num ] global proyectado [ NUM ] bloqueado trav base activo infraestructuro actual mundo activo infraestructuro largo vida operativo vida medio estimada central electrico carbon [ NUM ] [ NUM ] año proyectar [ NUM ] central electrica servicio construccion actualidad seguirar funcionamiento [ NUM ] significar mayorio emisión sector electrico año fijado cambio politico futuro obligar retirar planta existente reconversion captura almacenamiento carbono ccs,7
suresh c ministro ciudadania inmigracion ahani c mci corte supremo canado declarar trasladar refugiado acusado terrorismo pais correrio riesgo sustancial tortura abuso similar violaria practicamente derechos individuo s [ NUM ] carta canadiense derechos libertades corte merecer elogio reivindicar derechos humanos fundamental reclar contrapuesto seguridad nacional pisar él talón [ NUM ] septiembre victoria aspecto aparente real firme respaldo deferencia judicial ejercicio discrecion ministerial asuntos seguridad nacional corte dejar amplio margen eludir espiritu sentencia adhierar,16
decado [ NUM ] prevalecio atmosfera ineficacia capacidad policia abordar problema delictivo general problema droga callejera particular tactica aplicacion ley decado [ NUM ] tipicamente reactiva desenfocada general lograr interrumpir actividad mercado drogar nivel calle desarrollo estrategia policial proactiva enfocado decado [ NUM ] vigilancia policial orientado problema asociación tercero conducir fe renovado capacidad policia abordar eficaz problema droga nivel calle objetivo revision utilizar procedimiento metaanalitico evaluar eficacia relativo intervención aplicacion ley droga dirigido policia especificamente autor examinar efectividad relativo serie enfoque policial incluir vigilancia orientado problema vigilancia comunitario vigilancia punto criticos comparacion reactivo estandar aplicacion ley drogas domino practica policial decado [ NUM ],16
sentencia [ NUM ] enero [ NUM ] tribunal europeo derechos humanos tedh estrasburgo volvio cuestión planteado jurisprudencia detencion preventivo sicherungsverwahrung derecho penal alemar decision [ NUM ] diciembre [ NUM ] m c alemania tribunal sostener prorrogar retroactivo confinamiento detencion preventivo codigo penal alemar cumplia requisito detencion legal condena virtud art [ NUM ] [ NUM ] convenio proteccion derechos humanos libertad fundamental convenio viola prohibicion retroactividad art [ NUM ] [ NUM ] convenio articulo,16
capitulo ocupar perspectiva ambiente seguro sostenible mundo equitativo equitativo actualidad perspectiva parecer sombria serie desarrollo legal principio etico construir incluido convenio europeo proteccion ambiente traves derecho penal noción justicia ambiental ecologicar especie concepción derechos humanos capitulo secciones brindo descripcion general explorar vinculo derechos humanos problema ambiental examina ejemplo delito daño ambiental intento regularlo criminalizar él esbozar desarrollo criminologia verde propuesto ley internacional ecocidio marco abordar gama desafio finalmente comentario final llamar atencion debate dirección discusion investigacion,16
principio siglo xxi compromiso esfuerzo frenar corrupcion vuelto serio establecido multipl iniciativa anticorrupcion nivel mundial regional nacional nivel internacional convencion naciones unidas corrupcion uncac creado oportunidad desarrollar lenguaje global corrupcion estrategia implementacion coherente proposito promover fortalecer medida prevenir combatir corrupcion eficiente efectivo promover facilitar apoyar cooperacion internacional asistencia tecnico prevencion lucha corrupcion incluido recuperacion activo promover integridad rendicion cuentas gestion adecuado asunto publico propiedad publicar africar institute of corporate citizenship [ NUM ] [ NUM ],16
país creado agencia especializado lucha corrupcion alternativo recurso sistema judicial complejidad fenomeno corrupcion lucha corrupcion requerir habilidad especifico variedad campo incluido derecho finanza economio contabilidad ingenieria civil ciencias social funciones principal tal agencia aplicacion ley prevencion desarrollo politicas coordinacion revision comparativo agencia mundo revelar eficacia frenar corrupcion diferir país ejemplo exitoso singapur hong kong revision mostrar agencia lograr exito fracaso totalmente atribuible fuente importante falla relacion gobierno donant termino financiamiento independencia rendicion cuentas transparencia,16
pratki indio fabricante minorista estufa asocio selco india cadén suministro existente ventar luz solar población rural cadena suministro nacient acceso energiar tal area rural necesitarar subsidio comenzar gvep [ NUM ] gobierno empresa participar ardua tarea instalar tecnologia calefaccion eficaz recibir beneplacito inversión inicial entidad filantropica,7
medido administracion obama arma programa reforma servicio civil encontrar solución desafio clave reforma iniciativo gestion recurso humano administracion bush pasar alto campo seguridad nacional atencion prensa academico centro medido esfuerzo reforma administracion departamento seguridad nacional defensa discutido extensamente articulo kellough nigro brewer simposio desarrollo marco comun personal comunidad inteligencia ee uu paso relativamente desapercibido autor argumentar cambio gestion recurso humano realizado conformidad ley reforma inteligencia prevencion terrorismo [ NUM ] brindar modelo potencial administracion obama abordo desafio clave reforma afectado tiempo formulador politica reemplazar programa general enfoque modernizado compensacion clasificacion lograr equilibrio uniformidad nivel ejecutivo,16
despliegue retorico violento demostracion fuerza conducir arresto encarcelamiento extradicion inminente fundador wikileaks juliar assange servir momento ejemplar demostrar violencia sancionado cabl comenzar filtrar él noviembre [ NUM ] reaccion violenta wikileaks evidenciado numeroso experto politico pedir asesinato ejecucion assange movimiento ee mostrar autoritarismo escandalo wikigate representar importante ocasion balance pensar criticamente caso naturaleza soberano libertad informacion limit democracia importante violencia intentar manejar consideración foro explorar serie desafio inspirado wikileaks esperar impulsar debate reflexion geopolitico criticar,16
grupo defensa human rights watch amnistia internacional contribucion historica causa derechos humanos internacional publicar necesidad prevenir atrocidad masivo crimenes guerra genocidio asesinato tortura politico generalizado [ NUM ] estrategia grupo favorecer lograr objetivo enjuiciamiento perpetrador atrocidad estandar universal correr riesgo causar atrocidad evitario prestar suficiente atencion realidad politica [ NUM ] tribunal penal internacional reciente fracasar completo disuadir abuso posterior ex yugoslavia africa central tribunal incluido corte penal internacional cpi poder obtener cooperacion activo actor poderoso unido país ocurrir abuso cuestionable estrategia tendro exito plazo implementado pragmatico prueba error,16
corrupcion politico sector tierra generalizado dificil documentar enjuiciar efectivo articulo proporción evidencia corrupcion politico tierra malto miembro pequeño union europeo país densamente poblado mundo mostrar ley zonificacion altamente restrictivo pais regulador independiente jure creado oportunidad corrupcion generalizado endemico concesion permisos desarrollo tierra zona desarrollo brindar ejemplo gobierno crear institución instrumento recaudacion renta corregir falla mercado crear oportunidad corrupcion conjunto dato subyacente unico recopilo traves programa automatizado web scraping regulador rechazo ignoro solicitudes libertad informacion dato,16
programa denominar eficiencia energetico [ NUM ] objetivo lograr reduccion intensidad energetico [ NUM ] ciento [ NUM ] [ NUM ] ciento [ NUM ] programa incorporar areas encontrar empresa energeticamente eficiente construccion transporte energeticamente eficiente sociedad energeticamente eficiente sector energetico innovador,7
convencion naciones unidas derechos niño uncrc sigla ingl [ NUM ] tratado derechos humanos ratificado funcionar marco normativo innumerable actor trabajar pro,16
derecho union europea derecho penal habiar interactuar manera union adquirierar competencia explicitar asunto penal tratado maastricht intersección disposición supranacional nacional tratado frecuencia tjue general intervencion tribunal desencadenar recurso miembro sanción penal situación cubierto legislacion ue tal caso tjue llamado lograr equilibrio complicado ocupar él demanda competencia derecho penal miembro tiempo garantizar utilice coherente legislacion ue referenciar caso seleccionado documento destacar impacto principio establecido contexto libertad fundamental derecho penal ue [ NUM ] trabajo licencia creativar commons,16
documento investigar efecto gobernabilidad remesa enfoque especifico explicacion heterogeneidad relacion utilizar metodo kernel parametrico robusto forma arbitrario linealidad heterogeneidad especificacion modelo medida gobernanza indicador gobernanza mundial wgi analizar relacion [ NUM ] país periodo [ NUM ] [ NUM ] hallazgo mostrar medida voz rendicion cuenta estabilidad politico eficacia gobierno calidad regulatorio derecho control corrupcion significativamente relacionado remesa relacion lineal heterogenea país región tiempo aspecto especifico calidad gobernanza importancia remesa grupo regional necesidad agendo reformo gobernanza especifico pais lugar unico,16
articulo buscar identificar contribucion realizado corte internacional justicia cij corte derecho penal internacional genocidio sentencia [ NUM ] febrero [ NUM ] caso relativo aplicacion convencion sancion crimen genocidio bosnia herzegovinar c serbia montenegro [ NUM ] evaluacion general sentencia contener aclaraciones consolidación bienvenido derecho penal internacional genocidio aspecto corte entendio completamente complejo estructura crimen importante corte proporciono explicacion coherente caracterizacion atrocidad cometido srebrenico genocidio nota tratar detalle concepto acto estatal genocidio constituir internacionalmente ilicito conclusión factica cij  enfocar admitir sopesar prueba,16
doctrina derecho internacional privado representar limit natural medida inmutabl agencia publicar local mundo privado transnacional desafiar concepcion problematico requerir reinvencion campo especiar derecho publico instrumento gobierno fenomeno constitucional articulo investigar constitucion conflicto ley tipo caracteristica recibir enfasis especial idea conflicto ley fuente independiente normatividad constitucionalista mero receptaculo pasivo restricción impuesto derecho constitucional liberal clasico posibilidad formar constitucionalismo conflicto local mirado afuero complementar concepción federalista familiar enfocado adentro,16
articulo examina perspectiva critica teoria politico verde argumentar gobernanza ambiental emerger dominio cientifico tecnocratico contrastar trabajo bandera pericia civico proponer deliberacion participacion ciudadano ambito cientifico revertir caracteristica tecnocratica gestion ambiental ecofeminismo vincular surgimiento ciencia tecnocratico criticar general modernidad racionalidad patriarcado eco modernismo objetivo reconfigurar racionalidad cientifico terminos modernizacion reflexivo dimension participativo fuerte sociedad civil criticar verde posmoderno ascendencia ciencia regulatorio marca influencia biopoder gubernamentalidad verde experiencia civico presentar termino apreciación cuestionada ciencia sociedad moderno sustentar version post positivista conocimiento cientifico promover reforma ciencio,16
articulo evalua consejo seguridad naciones unidas respetar derechos humanos virtud derecho internacional actua virtud capitulo vii carto naciones unidas sostener consejo seguridad respetar derechos humanos consagrado tratado derechos humanos elaborado auspicio naciones unidas derecho internacional consuetudinario perentorio incompatible objetivo consejo seguridad mantener restablecer paz seguridad internacional analisis argumentar consejo seguridad cumplir derechos humanos internacional imperativo excepcion documento concluir accion capitulo vii consejo seguridad limitado pequeño medida norma internacional derechos humanos,16
presuncion inocencia colocar carga probar proceso penal acusacion mayorio declaración derechos humanos carta derechos constitucional ataque proposito conferencia examinar justificación limitar presuncion erosionar él excepción evadir él eludir él fuerte diverso argumento politico publicar control crimar respaldir amenaza presuncion inocencia,16
articulo analizar avance retroceso derecho constitucional derecho internacional posguerra analizar mundo emerge orientacion normativa igualitario carta onu declaracion universal derechos humanos pacto [ NUM ] acercar él constitucionalismo global desigual plan factico investigacion realizo traves revision literatura,16
articulo capitulo manual investigacion litigio accionista publicar principio [ NUM ] detalla metodo tribunal cancilleria delaware afirmar jurisdiccion personal director funcionario corporación delaware artaculo comenzar discusia[num]n antecedente sistema secuestro aonico delaware declarado inconstitucional shaffer v heitner [ NUM ] describir enfoque actual delaware estatuto responsabilidad principal bás consentimiento implicito seccion [ NUM ] articulo detalla enfoque responsabilidad fiduciario litigio delaware estatuto general brazo seccion [ NUM ] doctrina teorio conspiracion common law articulo analizar decision [ NUM ] corte supremo delaware hazout v tsang mun ting escrito presidente tribunal supremo strine fallo transcripcion vicecanciller laster badlands ngls llc v cascade capital corp [ NUM ],16
kahler v kansa corte supremo sostener kansa violo clausula proceso abolio defensa locuro resultado predecible llego resultado particularmente extraño tribunal abolicion defensa locura constitucional kansa realmente abolio defensa locura absoluto buscar mostrar articulo analisis corte erroneo cuestion derecho constitucional comprension adecuado principio derecho penal leccion importante caso preguntar incorrecto obtién respuesta incorrecto,16
crecimiento desacelero decado [ NUM ] energiar transporte mantenido relativamente estable [ NUM ] figurar [ NUM ] [ NUM ] numero vehiculo distancia recorrido vehiculo estancado emisión [ NUM ] [ NUM ] superior cantidad asignado [ NUM ] [ NUM ] mt c[num ] eq año virtud protocolo kioto,7
capitulo explicar exito futuro primavera arabir alcanzar moderno democratico seguridad ee capacidad diplomatica defensa desarrollar integrar instrumento caso reciente revolución mena meta facil abordo fin politico basado teoria criticar seguridad humano obtener informacion objetivo volver palabra presidente obamar discurso cairo [ NUM ] ee uu implementar sustancialmente [ num]d diplomacia defensa desarrollo dado geopolitica actual oriente forma creativo abordar problema primavera arabir prueba liderazgo estadounidense,16
