Textos_espanol,sdg_predict
proporcion energia renovable jordania consistente promedio oriente [ NUM ] usaid [ NUM ] analista proyectar [ NUM ] [ NUM ] electricidad region generara fuente renovable menon [ NUM ] jordania explotar completamente recurso solar convertir él lider mundial exportador energiar energia renovable futuro actualmente estimar energia renovable contribuir crecimiento [ NUM ] [ NUM ] [ NUM ] pib jordania crea [ NUM ] [ NUM ] puesto trabajo usaid [ NUM ] proyecto energiar renovable intensivo mano obra fuente energiar convencional razón esperar aumento neto empleo energia renovable significativo momento empleo sector hidrocarburo minimo ocde [ NUM ] proximamente b,7
   nordico actor excepcional erradicacion torturar nordico fama emprendedor norma prohibicion derecho internacional tortura involucrar practica interno mella afirmacion superioridad luchar torturo documento desafiar imagen contrastant compromiso nordico norma internacional derechos humanos examinar proceso revision periodico virtud convencion torturar especificamente preguntar observación final emitido cometer tortura sugerir evidenciar excepcionalismo nordico termino compromiso derechos humanos documento analizar oc nordico comparacion decada analizar especificamente cuestión definicion torturar ley condición detencion hallazgo sugerir comite somete nordico escrutinio revelar diferencia motivo particular preocupacion frustracion negar él atender llamado recurrente reforma,16
ilustrar claramente reequilibrio sector significativo efecto agregado empleo cambio respuesta impuesto energiar utilizar él guia respuesta empleo aumento equivalente precio energiar resultado cambio tecnologia energetica sostenible reimpreso permiso asociacion internacional economia energetico editores energy journal,7
equipo refuerzo antorcho gas [ NUM ] mes [ NUM ] proyecto comercial gas vertedero demostrado cumplir requisito sudafricano seguridad desempeño ambiental abrir mercado infraestructuro energiar limpio aumentar competencia gobierno querer desarrollar capacidad empresa estatal competir mercado resolver desafio implicar combinacion abrir parcialmente mercado mantener empresa estatal,7
documento examín papel sistema informacion geografica abuja iniciativa politico gobierno electronico promover reduccion corrupcion prestacion servicio administracion tierra electronica gobernanza general documento exploro contribucion administracion electronicar tierra forma corrupcion fraude falsificacion solicitud multipl soborno nepotismo favoritismo malo practicar cuello blanco servicio busqueda legal recertificacion titulo otorgamiento derechos ocupacion consentimiento enajenacion regularizacion titulo general hallazgo sugerir corrupcion reducir introduccion servicio electronico verificacion registro tierra trav busqueda legal recertificacion titulo propiedad persistir aumentar forma corrupcion nepotismo favoritismo,16
agencia internacional energiar ejemplo compilado serie regla oro explotar gas natural sostenible tratar agua responsable estudiar geologia areo perforacion iea [ NUM ] figurar [ NUM ] [ NUM ] ilustrar desg él él necesidad inversion ejemplo usd [ NUM ] millón necesario energia renovable fraccion usd [ NUM ] [ NUM ] millón [ NUM ] [ NUM ] millón necesario sector energetico general periodo eficiencia energetico requerir inversión usd [ NUM ] millón generar importante ahorro financiero,7
resumen tener derogacion ley impunidad [ NUM ] [ NUM ] interesar reconstruir reapertura juicio violación derechos humanos argentino caso simon fallo [ NUM ] confirmado corte supremo justicia [ NUM ] ley [ NUM ] [ NUM ] [ NUM ] sancionada congreso nacional derogo expresamente ley amnistiar finalmente enfoque judicial ensamblar circuito represion terrorismo [ NUM ] [ NUM ] megacausa marco nocion genocidio foco comprender complejidad judicial caso argentino justicia transicional palabra clave dictadura civico militar argentino [ NUM ] [ NUM ] justicia transicional genocidio,16
examino estadounidense derecho internacional torturar legitimar politica practica tortura decado [ NUM ] caso mostrar problema derecho internacional ciencia politico conceptualizar cumplimiento incumplimiento derecho internacional brechaber compromiso legal practicar ee uu reflejar sugerencia ee uu optar violar obligación virtud convencion torturar instrumento lugar cumplirla cambio ee uu derecho internacional torturar justificar politica tortura derecho internacional utilizo herramientar concurso legitimacion ee uu sugiero practica comun abrir comprension politico naturaleza derecho internacional,16
presente contribucion dedicado analizar desarrollo reciente aspecto seleccionado ley servicio civil union europeo analisis ayudar evaluar solidez enfocar predominante revision judicial acto legislativo control judicial acto individual afectar derecho trabajador funcion publica union europeo analizar jurisprudencia principio igualdad sugerir ocasión dicho jurisprudencia mostrar deferencia excesivo legislador union europeo necesario argumentacion precisar campo realizar revision jurisprudencia relativo derechos deber trabajador temporal poner manifiesto necesidad reforzar control ejercer tribunal europeo tribunal funcion publicar caso supuesto despido discriminatorio,16
capitulo objetivo explorar analizar lugar derecho internacional sistema legal albán aplicacion tribunal albanés capitulo abordo estatus derecho internacional constitucion albania [ NUM ] interaccion fuente derecho sistema legal albán posteriormente analizar caso nacional importante ilustrar enfoque adoptado tribunal albanés derecho internacional capitulo centrar cuestión relacionado lugar aplicacion derechos humanos derecho europeo derecho penal internacional mecanismo relacionado sistema legal albán,16
resumeneste articulo examín efecto operación internacional mantenimiento paz antiterrorista onu posibilidad paz mali operacion francés serval enero [ NUM ] intervencion internacional dividio misión militar mantenimiento paz onu mali lucha terrorismo liderado francia articulo exploro significar distinguir mantenimiento paz luchar terrorismo gestion conflicto internacional dinamicar resolucion conflicto mali argumentar concepto binario guerro paz intervencion soberania opuesto desdibujan normalidad emergente intervencion militar permanente mostrar construccion gobernanza regional antiterrorista militarizacion eludir cuestión fundamental paz soberania estatal nacionalidad mali articulo señalar division trabajo internacional mantenimiento paz luchar terrorismo definar posibilidad paz,16
derecho prueba moderno alcance amplio limit incierto influenciado caracteristica clave procedimiento contradictorio autonomiar oralidad prueba sistema acusatoriir jurisdicción derecho consuetudinario generalmente implicar adjudicacion versión contrapuesta hecho presentado testigo experto perito olvidar deber tribunal independiente objetivo independientemente contratado parte calificacion testigo actuar perito tecnicamente cuestion competencia determinado tribunal vincular conceptualmente escollo admisibilidad prueba opinion surgen duda calificacion perito practica moderno recibir prueba peso abierto comentario adverso serio pericia aparente traducir realidad,16
vital gobierno resucitir importante debate trabajo escalar efecto externo sector energetico año ochenta noventa comparado escala externalidad discutido fondo necesario investigacion insignificante tiempo trabajo administrar él estricto centrar él cuestión clave contribuir formulacion politica contexto transición energetica curso difundir sintetizar conocimiento caracteristica destacado coste total suministro electrico clave llegar trav internalizacion progresivo coste social mejor politica combinación electrica sostenible,7
autor identificar brecho ley policial canadiense policia derecho consuetudinario autoridad estatutario emprender tipo medida policial orden publico considerar esencial asegurar evento publico juego olimpico vancouver [ NUM ] documento abogar adopcion ley vigilancio orden publico diseñado conferir poder necesario garantizar funcionamiento respete derecho constitucional libertad civil fundamental revisado publicado w wesley pue robert diab oethe gap in poder policial canadiense canado necesitar legislacion vigilancia orden publico [ NUM ] [ NUM ] windsor rev legal soc numero [ NUM ] [ NUM ] publicado http toby library ubc car facultypubs articlar cfm id [ NUM ],16
estudio aprobado publicacion comite desarrollo nuclear ndc anar ocde philippe lebreton francia aportacion importante capitulo [ NUM ] efecto energiar nuclear nivel sistema electrico seccion capacidad seguimiento carga central nuclear potencial flexibilidad central nuclear corto plazo bás trabajo dr alexey lokhov division desarrollo nuclear ocde anar capitulo [ NUM ] marcos regulatorio internalizacion efecto sistema remuneracion adecuado servicio flexibilidad eduard blanquet i arago ocde nea division desarrollo nuclear preparo borrador,7
previsibilidad politica importante permitir inversor evaluar riesgo cambio politica inversión potencial mayo [ NUM ] establecio agencia nacional eficiencia energetico incluir requisito energetico edificio [ NUM ] kwh m[num ] año evaluacion renovacion eficiencia energetico edificio propiedad estatal,7
desenredar factor imposible practicar informe deloitte[num ] encontro incertidumbre politico perjudicial inversion electricidad carga base incluido turbina gas ciclo combinado resultado ocgt considero inversion menor riesgo costo capital bajo deloittir calculo costo incertidumbre politico termino suboptimidad inversion caracterizado preferencio ocgt lugar ocgt,7
ley proteccion victimas torturo tvpa sigla ingl establecer causa accion federal explicito torturo ejecución extrajudicial cometido amparo ley extranjero mundo nombre individuo incluido ciudadano estadounidense tvpa constituir expresion moderno apoyo congreso ejercicio jurisdiccion extraterritorial violación atroz derechos humanos tvpa autorizar persona sometido torturar demandar daño perjuicio autorizar demanda ejecucion extrajudicial representante legal persona muerto persona demandante accion muerte injusta historia legislativo tvpa sugerir tribunal recurrir ley foro determinar representante legal patrimonio difunto palabra clave jurisdiccion extraterritorial violación derechos humanos ley proteccion victimas torturar tvpa,16
[ NUM ] septiembre [ NUM ] cometer nación unidas onu derechos persona discapacidad determino gobierno australiano incumplido obligación virtud convencion naciones unidas derechos persona discapacidad caso australia presentado marlon noble hombre aborigen discapacidad intelectual acusado agresion sexual apto juzgado virtud ley acusado discapacidad mental [ NUM ] wo encarcelado indefinidamente [ NUM ] detencion civil comunidad [ NUM ] articulo analizar politico actual contexto legislativo australia occidental tema reflexionar respuesta anterior australiir denuncia individual derechos humanos onu comit,16
veinte año comenzo debate academico curso direccion futuro ley europa line batalla trazar teoria convergencia convergencia documento reexamina discutir teorio convergencia interpretacion elemento cultural juridico clave derecho consuetudinario ingl luz debatir derechos humanos objetivo resaltar tensión derechos humanos derecho publico reino unido aplicacion enfoque derecho comparado culturalmente orientado foco analisis ley derechos humanos formar adaptado ordenamiento juridico argumentar perspectiva cultural juridico aportar aspecto benefico comprender debate centrado ley derechos humanos reducir él exclusivamente politico parcialmente debate catalizado caracteristica derecho civil continental ley derechos humanos transfirio derecho consuetudinario,16
preve intercambio informacion dato part prevencion inundación intercambio informacion instalaciones objeto bulgario informar activo momento discusión renovacion actualizacion curso finalmente firmo ministerio ambiente agua republico bulgario ministerio ambiente planificacion fisico obra publica republico helenico [ NUM ] cooperacion campo proteccion medioambiental resultado mayo [ NUM ] establecio grupo trabajo conjunto bulgaro griego cooperacion proteccion agua,6
participacion parte interesado trav gobernanza inclusivo agua reconocer fundamental asegurar apoyo reforma crear concienciar riesgo costo agua aumentar disposicion pagar usuario manejar conflicto luchar consenso traves gobernanza colaborativo allanar camino accion proporcionen salvaguardia permitir participacion representacion equitativo parte interesado instrumento politico abordar contaminacion fuente puntual fuente difusa caracteristica,6
revision implementacion ley energias renovable avanzar precio electricidad dinamico medida dsm despacho preferencial estricto control gobierno central precio desafio clave socavar esfuerzo ampliar capacidad transmision generacion flexible pais medida tomar soler administrativo cambio impulsado establecimiento objetivo fuerzas mercado,7
estandar tecnico armonizado asociación industrial defender energia limpio debil escepticismo consumidor acerca beneficio tecnologia energia limpio informacion eficacia incentivo mecanismo fiscal acceso financiamiento banco multilateral institución financiero debil patrocinador proyecto carecer experiencia preparacion solicitud prestamo financiamiento,7
articulo analizar desarrollo acceso justicia organización ambiental ley holandés formado parte centrar auge derecho acceso tribunal organización ecologista jurisprudencia legislacion relativo ley general derecho administrativo concesion permiso ambiental analizar posibilidad organización ecologista presentar acción tribunal civil abordo desmantelamiento derecho acceso tribunal discutir desarrollo reciente legislacion jurisprudencia posible cambio futuro articulo concluir observación final situacion actual país bajo relacion convencion aarhus,16
gestion sostenible agua saneamiento sustentar esfuerzo amplio acabar pobreza promover desarrollo sostenible mantener paz estabilidad mundo camino alcanzar meta global ods [ NUM ] [ NUM ] ritmo actual progreso gobierno nacional decidir incorporar meta ods [ NUM ] proceso politica estrategia planificacion nacional establecer meta tener circunstancia local dato sustentar gobernanza agua,6
país bajo cargo aplicar descarga industrial municipal agua estatal vinculado carga contaminacion calcular funcion coeficiente convertir equivalente poblacion p sistema establecer inicialmente recuperar costo administrativo concesion licencia monitoreo cumplimiento ultimos año incentivo titular licencia reducir continuamente descarga agua vuelto prominente gal sur [ NUM ] introducir esquema licencia basado cargo lbl vincular tarifa licencia emisión contaminante proporcionar incentivo reducir contaminacion,6
articulo presentar emprendimiento preliminar cuestión cuasi constitucionalidad constitucionalismo amplio concepto organico autor examina marco constitucional historico politico zelandir demostrar base actividad dinamicar generativo reflexion constitucional politico nocion discutir tratado waitangi enfocar particular intrigantes desafio plantear tratado interpretar cuasi constitucionalidad autor concluir reconocer problema conceptual surgen relacionar cuasiconstitucionalidad instrumento tratado giro historico enfocar norma constitucional codificada significado constitucional ley,16
proposito infelicidad reconocido principal factor causar inestabilidad politico region oriente africa norte mena ultimos año proposito estudio investigar efecto asunto gobernanza felicidad region mena controlar determinant relevante diseño metodologia enfocar documento aplico analisis regresion efecto aleatorio panel dato [ NUM ] país mena periodo [ NUM ] [ NUM ] hallazgo resultado empirico mostrar nivel estabilidad politico ausencio violencio efectividad gobierno derecho aumentar significativamente felicidad region articulo variable voz rendicion cuenta calidad regulatorio control corrupcion relacion positivo felicidad significativo originalidad valor mayorio estudios area cubrir país desarrollado hallazgo país desarrollado directamente transferible economia emergente,16
consenso creciente sistema parlamentario declaración derecho promulgado recientemente constituir modelo constitucionalismo servir punto soberania parlamentario supremacia judicial caracteristica clave discutido relacion modelo revision judicial forma debil commonwealth nocion dialogo poder derechos permitir legislatura responder fallo judicial politica juego articulo desarrollar marco evaluar empiricamente dialogo operar practico examen sistematico respuesta legislativo fallo corte supremo afectar legislacion canado practica ocurrir relativamente dialogo genuino legislatura rara responder aparte dictado fallo corte articulo explorar implicación tipo evaluacion empiricar sistema parlamentario,16
[ NUM ] [ NUM ] miembro organizacion maritima internacional omi adoptar protocolo [ NUM ] convenio [ NUM ] represion acto ilicito seguridad navegacion maritimo sua convenio sua [ NUM ] resultante tratado integral seguridad maritimo agilizar integro esfuerzo prevenir interrumpir terrorismo maritimo decado transcurrido adopcion adherido tratado mayoria tomado medida requerir tratado implementar él efectivo necesidad articulo proporcionar hoja ruto implementacion convencion sua [ NUM ] realidad vision regimar mundial eficaz combatir terrorismo maritimo,16
ley islamico material reforma derecho penal principal caracteristica derecho pancasilo garantizar libertad religion ley aplicable existente consistente ideal legal sociedad indonesio valor ley islamico reflejar él ley nacional materializacion ideal legal azot tipo castigo prescrito corar sunnah articulo [ NUM ] rkuhp contener principio legalidad material aprobar ley existente comunidad sociedad ley penal adat respetar ley diversidad pluralidad indonesio consecuencia regulacion delictivo sancion penal encomendada desarrollo jurisprudencia regulacion regional palabra clave azot reforma derecho penal derecho islamico,16
resumen elogiar asociacion nacional evangelico firmar declaracion torturo documento abordo tema terrorismo justificacion tactica interrogatorio terrorista unidos proteger unido proposito moral elevado emplear medio injusto servir superior pasar tiempo derecho estadounidense particular camarada servicio militar tener rango superior derecho amenazandono llegado momento institución iglesia universidad seminario enseñar gobernabilidad justo base proteccion derechos humanos,16
[ NUM ] veinte año etiopio democratica revolucionario [ NUM ] [ NUM ] [ NUM ] federalismo basado etnicidad etnicidad etiopio reevaluar experimento [ NUM ] año [ NUM ] construccion democratico revolucionario partido pueblo etiopia eprdf [ NUM ] democracia abyotawi revolucionario democratico revision criticar concepcion democraciar revolucionario eprdf etiopio [ NUM ] [ NUM ] des formacion coalición oposicion desafio democratizacion etiopio [ NUM ] [ NUM ] [ NUM ] separacion poder implicación judicial etiopio [ NUM ] prensa reestructuracion politico etiopio [ NUM ] descentralizacion hogar expansion limit estatal zona rural oromiyar [ NUM ] democracia revolucionario pluralidad religioso eprdf islam cristianismo etiopia posterior derg [ NUM ] superposicion proyecto nacionalista espacio disputar [ NUM ] oromo negociacion ayuda incomoda asociacion eprdf donant,6
establecer condición pacificacion intergrupal efectivo tarea formidable conflicto etnico severo profesional resolucion conflicto argumentar paso critico desarrollar condición previo convenzar grupo competencia oponent valer pena hablar crear cambio estructural conducir paz estable satisfacer preocupación necesidad basica articulo compar teoria practicar resolucion conflicto etnico relación comunitario negociacion basado principio necesidad humano identidad arraigado psicoanaliticamente malentendido intercultural transformacion conflicto examinando entender conflicto etnico objetivo articular efecto practicar participant intervención mecanismo proyecto lograr impacto dinamicar transferencia afectar curso conflicto amplio argumentar articulacion claro supuesto,16
empresa intensivo energiar exento recargo eeg aumentar costo produccion empresa intensivo energiar deteriorar competitividad precio mayorio estudio asumir costo apoyo fer disminuira significativamente aumento productividad efecto aprendizaje tecnologico sector fer contrario frondel et,7
auge movimiento social estudio juridico estadounidense respuesta actual antiguo problema pensamiento juridico progresista aprovechar derecho cambio social mantener distincion derecho politico problema estallo controversiar torno concepto liberalismo legal derechos civil definido tribunal activista abogado buscar reforma politica traves ley academico legal contemporaneo respondido basar él ciencia social desarrollar concepto liberalismo movimiento asignar liderazgo cambio transformador movimiento social preservar rol convencional tribunal abogado liberalismo movimiento objetivo lograr promesa perdido reforma progresista tiempo evitar critica activismo legal dividido academico siglo lugar resolver problema ley politico liberalismo movimiento reproducir debate largo datar llevar visión critica ley buscar trascender,16
documento analizar actual derecho internacional regir comercio arma implicación futuro tratado comercio armas cubre amplio gama cuerpo derecho internacional superponer especificamente carta naciones unidas derechos humanos derecho humanitario derecho penal internacional,16
estudio goldemberg [ NUM ] energia renovable crear [ NUM ] [ NUM ] puesto trabajo twh teravatio horo producido frente [ NUM ] [ NUM ] energia convencional petroleo carbon gas natural ocde [ NUM ] capitulo [ NUM ] chino instalo [ NUM ] [ NUM ] gw central hidroelectrica [ NUM ] capacidad instalado pais microhidroelectrico tecnologia desarrollado capacidad instalado mundo [ NUM ] gw mitad chino indio unidos acordar cooperar aumentar capacidad generacion energia nuclear indio metodo clave reducir emisión gas efecto invernadero riso [ NUM ],7
resumen globalizacion economico particular inversion extranjero directo ied considerado catalizador reforma economico liberalizacion politico argumentar apertura inversion extranjero estimula democratizacion empoderar actor pro liberalizacion socavar cohesion elit articulo explorar prueba hipotesis alternativo vincular ied supervivencia regimar autocratico hipotesis liberalizacion afirmar ied promueve democratizacion hipotesis capturo sugerir ied aumentar valor aumentar riesgo transicion autocratica hipotesis estabilizacion contrariamente primeras afirmar ied mejorar estabilidad dictadura abrir oportunidad distribuir beneficio elit regimar analisis empirico abarca [ NUM ] país periodo [ NUM ] [ NUM ] utilizar dato ruptura autocratica tipo transicion probar hipotesis anterior evidencia reportado,16
articulo examina punto serbia implementado norma internacional pertinente accion delincuencia organizado transnacional contenido convencion naciones unidas delincuencia organizado transnacional [ NUM ] explorar obligación clave especial referencia prohibicion delito sustantivo ley basado inteligencia aplicacion ley tecnica especial investigacion confiscacion producto delictivo cooperacion internacional materia aplicacion ley articulo analizar serbio implementar obligación realidad examir marcos legislativo practica aplicacion ley conclusion principal serbia tomado medida implementar norma internacional mira mejorar acción individual colectivo crimen organizado transnacional aplicacion efectivo ley ver obstaculizado problema corrupcion falta conocimiento experiencia recurso,16
nigeria victimo corrupcion alto nivel gobierno inestabilidad politico crisis legitimidad ciclico ausencio apoyo sociedad civil efectivo gobierno ver erosionado relación patron cliente asumir papel primordial aspecto formal politico derecho funcionamiento partido politico sistema electoral creible romper ciclo garantizar gobernanza garantizar rendicion cuentas transparencia indicador economico nesg vol [ NUM ] [ NUM ] [ NUM ] pag [ NUM ] [ NUM ],16
pais soberania absoluto exclusivo espacio aereo pais soberano derecho administrar ruta vuelo espacio aereo espacio aereo estrategico defensa seguridad producir violación soberania espacio aereo indonesio aeronave civil estatal problema discutido relacionar arreglo legal aplicacion ley violación territorio soberano pais derecho internacional ley nacional indonesio metodo investigacion investigacion juridico normativo enfoque estatutario enfoque historico enfoque conceptual enfoque comparativo resultado investigacion presento formo analisis descriptivo resultado concluir derecho internacional nacional suficientemente estricto determinar parametro estatus legal aeronave civil estatal cosa resultar conflicto serio relacionado regulación tal aeronave,16
reducir corrupcion sector telecomunicación requerir reforma licencia liberalizacion ignoro riesgo conocido corrupcion país desarrollo sector telecomunicación permitio entrada florecimiento soborno amiguismo nepotismo discusion corrupcion presente esencial politico director ejecutivo establecer tono alto limpio registro publico beneficiario final operador vital empresa ficticio nominado incluido socio minoritario faltar divulgacion informacion conllevar sanción país requerir apoyo combinar esfuerzo anticorrupcion politica regulación sector telecomunicación país cumplir obligación virtud convencion naciones unidas corrupcion uncac criminalizar corrupcion nacional extranjero crear capacidad investigar enjuiciar,16
